{
  "$schema": "https://servercn.vercel.app/schema/registry.json",
  "name": "Servercn",
  "homepage": "https://servercn.vercel.app",
  "author": "Akkal Dhami",
  "items": [
    {
      "slug": "introduction",
      "title": "Introduction",
      "description": "Servercn is a component-based backend development system for Node.js and TypeScript.",
      "type": "guide",
      "status": "stable",
      "docs": "/docs/introduction"
    },
    {
      "slug": "cli",
      "title": "Servercn CLI",
      "description": "The Servercn CLI provides a set of commands to help you manage your Servercn projects.",
      "type": "guide",
      "status": "stable",
      "docs": "/docs/cli",
      "meta": {
        "new": true
      }
    },
    {
      "slug": "installation",
      "title": "Installation",
      "description": "Learn how to install and set up Servercn in your project.",
      "type": "guide",
      "status": "stable",
      "docs": "/docs/installation"
    },
    {
      "slug": "js-guide",
      "title": "JavaScript Guide",
      "description": "JavaScript guide for developers who are comfortable with JavaScript and want to use Servercn components without diving into TypeScrip",
      "type": "guide",
      "status": "stable",
      "docs": "/docs/guides/js-guide",
      "meta": {
        "new": true
      }
    },

    {
      "slug": "component",
      "title": "Component",
      "description": "Contribute reusable backend components for Node.js projects. Learn about component structure, testing, and submission guidelines.",
      "type": "contributing",
      "status": "stable",
      "docs": "/docs/contributing/component"
    },
    {
      "slug": "blueprint",
      "title": "Blueprint",
      "description": "Create and share complete project blueprints. Understand blueprint architecture and how to design scalable application templates.",
      "type": "contributing",
      "status": "stable",
      "docs": "/docs/contributing/blueprint"
    },

    {
      "slug": "foundation",
      "title": "Foundation",
      "description": "Build foundational elements like authentication, database connections, and core utilities. Contribute to the base layers of Servercn.",
      "type": "contributing",
      "status": "stable",
      "docs": "/docs/contributing/foundation"
    },
    {
      "slug": "schema",
      "title": "Schema",
      "description": "Define and contribute data schemas for consistent API structures. Learn about schema validation and documentation standards.",
      "type": "contributing",
      "status": "stable",
      "docs": "/docs/contributing/schema"
    },
    {
      "slug": "jwt-utils",
      "title": "JWT Utilities",
      "description": "JWT Utilities for JSON Web Token authentication with access & refresh token support for Express",
      "type": "component",
      "status": "stable",
      "frameworks": ["express"],
      "docs": "/docs/components/jwt-utils"
    },
    {
      "slug": "global-error-handler",
      "title": "Global Error Handler",
      "description": "Centralized error handling for Express applications using TypeScript.",
      "type": "component",
      "status": "stable",
      "frameworks": ["express"],
      "docs": "/docs/components/global-error-handler"
    },
    {
      "slug": "error-handler",
      "title": "API Error Handler",
      "description": "A lightweight, production-ready error handling utility for Express applications.",
      "type": "component",
      "status": "stable",
      "frameworks": ["express"],
      "docs": "/docs/components/error-handler"
    },
    {
      "slug": "response-formatter",
      "title": "API Response Formatter",
      "description": "A standardized, type-safe API response wrapper for Express applications.",
      "type": "component",
      "status": "stable",
      "frameworks": ["express"],
      "docs": "/docs/components/response-formatter"
    },
    {
      "slug": "async-handler",
      "title": "Async Request Handler",
      "description": "The Async Handler component is a foundational Express utility that ensures all errors thrown inside asynchronous route handlers are reliably captured and forwarded to Express's global error middleware.",
      "type": "component",
      "status": "stable",
      "frameworks": ["express"],
      "docs": "/docs/components/async-handler"
    },
    {
      "slug": "password-hashing",
      "title": "Password Hashing",
      "description": "The Password Hashing component provides a standardized way to hash passwords in Servercn using bcryptjs, argon2, pbkdf2, scrypt.",
      "type": "component",
      "status": "stable",
      "frameworks": ["express"],
      "docs": "/docs/components/password-hashing",
      "meta": {
        "new": true
      }
    },
    {
      "slug": "http-status-codes",
      "title": "HTTP Status Codes",
      "description": "Centralized, type-safe HTTP status codes for consistent API responses.",
      "type": "component",
      "status": "stable",
      "frameworks": ["express"],
      "docs": "/docs/components/http-status-codes"
    },
    {
      "slug": "verify-auth-middleware",
      "title": "Auth Verification Middleware",
      "description": "Auth Verification Middleware protects private routes by validating user authentication using JWT access tokens and refresh tokens.",
      "type": "component",
      "status": "stable",
      "frameworks": ["express"],
      "docs": "/docs/components/verify-auth-middleware"
    },
    {
      "slug": "logger",
      "title": "Structured Logger",
      "description": "Structured and configurable logging for Node.js applications using Winston or Pino.",
      "type": "component",
      "status": "stable",
      "frameworks": ["express"],
      "docs": "/docs/components/logger",
      "meta": {
        "new": true
      }
    },
    {
      "slug": "file-upload-cloudinary",
      "title": "File Upload (Cloudinary)",
      "description": "The File Upload component provides a standardized way to handle file uploads in Servercn using Cloudinary as the storage provider.",
      "type": "component",
      "status": "stable",
      "frameworks": ["express"],
      "docs": "/docs/components/file-upload-cloudinary",
      "meta": {
        "new": true
      }
    },
    {
      "slug": "file-upload-imagekit",
      "title": "File Upload (ImageKit)",
      "description": "The File Upload component provides a standardized way to handle file uploads in Servercn using ImageKit as the storage provider.",
      "type": "component",
      "status": "stable",
      "frameworks": ["express"],
      "docs": "/docs/components/file-upload-imagekit",
      "meta": {
        "new": true
      }
    },
    {
      "slug": "email-service",
      "title": "Email Service",
      "description": "The Send Email component provides a standardized way to send emails in Servercn using nodemailer as the email service provider.",
      "type": "component",
      "status": "stable",
      "frameworks": ["express"],
      "docs": "/docs/components/email-service",
      "meta": {
        "new": true
      }
    },
    {
      "slug": "not-found-handler",
      "title": "Not Found Handler",
      "description": "The Not Found Handler component provides a standardized way to handle not found routes in Servercn.",
      "type": "component",
      "status": "stable",
      "frameworks": ["express"],
      "docs": "/docs/components/not-found-handler"
    },
    {
      "slug": "request-validator",
      "title": "Request Validator (Zod)",
      "description": "The Request Validator (Zod) middleware provides a type-safe and declarative way to validate incoming HTTP requests in Servercn using Zod.",
      "type": "component",
      "status": "stable",
      "frameworks": ["express"],
      "docs": "/docs/components/request-validator"
    },
    {
      "slug": "health-check",
      "title": "Health Check Endpoint",
      "description": "Production-ready health check endpoints for monitoring API status, database connectivity, and system health in Express applications.",
      "type": "component",
      "status": "experimental",
      "frameworks": ["express", "nestjs"],
      "docs": "/docs/components/health-check"
    },
    {
      "slug": "google-oauth",
      "title": "Google OAuth",
      "description": "The Google OAuth component provides a standardized way to handle Google OAuth authentication in Servercn.",
      "type": "component",
      "status": "stable",
      "frameworks": ["express"],
      "docs": "/docs/components/google-oauth",
      "meta": {
        "new": true
      }
    },
    {
      "slug": "shutdown-handler",
      "title": "Graceful Shutdown Handler",
      "description": "The Graceful Shutdown Handler ensures that your Servercn application terminates safely and predictably when the process receives shutdown signals (e.g. SIGTERM, SIGINT).",
      "type": "component",
      "status": "stable",
      "frameworks": ["express"],
      "docs": "/docs/components/shutdown-handler"
    },
    {
      "slug": "rbac",
      "title": "Role Based Access Control",
      "description": "The Role Based Access Control component provides a standardized way to handle role based access control in Servercn.",
      "type": "component",
      "status": "stable",
      "frameworks": ["express"],
      "docs": "/docs/components/rbac"
    },
    {
      "slug": "rate-limiter",
      "title": "Rate Limiter",
      "description": "The Rate Limiter component provides a standardized way to handle rate limiting in Servercn.",
      "type": "component",
      "status": "stable",
      "frameworks": ["express"],
      "docs": "/docs/components/rate-limiter"
    },
    {
      "slug": "github-google-oauth",
      "title": "GitHub & Google OAuth",
      "description": "The GitHub & Google OAuth component provides a standardized way to handle GitHub & Google OAuth authentication in Servercn.",
      "type": "component",
      "status": "stable",